[
  {
    "event_type": "student_turn",
    "actor": "sol",
    "phase": "W_question",
    "exercise_id": "who-04",
    "payload": {
      "text": "I'm Ninereeds.",
      "behavior_tag": "correct_self_identification",
      "simulator_basis": "hidden_profile_and_known_closure"
    }
  },
  {
    "event_type": "student_turn",
    "actor": "sol",
    "phase": "OR_question",
    "exercise_id": "or-01",
    "payload": {
      "text": "I'm Bob.",
      "behavior_tag": "named_nonlearner_alternative_error",
      "simulator_basis": "hidden_profile_and_known_closure"
    }
  },
  {
    "event_type": "student_turn",
    "actor": "sol",
    "phase": "OR_question",
    "exercise_id": "or-02",
    "payload": {
      "text": "I'm Ninereeds.",
      "behavior_tag": "correct_or_self_identification",
      "simulator_basis": "hidden_profile_and_known_closure"
    }
  },
  {
    "event_type": "student_turn",
    "actor": "sol",
    "phase": "OR_question",
    "exercise_id": "or-03",
    "payload": {
      "text": "I'm Ninereeds.",
      "behavior_tag": "correct_or_self_identification",
      "simulator_basis": "hidden_profile_and_known_closure"
    }
  }
]
