[
  {"event_type":"teacher_turn","actor":"luna","phase":"affirmative","exercise_id":"l001-cp-a01-cup","payload":{"action":"ask","delivery_mode":"machine_control","text":"SHOW_LABEL_SELECT_MATCHING_IMAGE","script_ref":"l001-cp-a01-cup/teacher_turn_1","claim_ids":[],"language_receipt":{"known_forms":[],"frontier_forms":[],"instruction_phrases":[],"rescue_phrases":[],"unlicensed_forms":[]}}},
  {"event_type":"teacher_turn","actor":"luna","phase":"affirmative","exercise_id":"l001-cp-a02-plate","payload":{"action":"ask","delivery_mode":"machine_control","text":"SHOW_LABEL_SELECT_MATCHING_IMAGE","script_ref":"l001-cp-a02-plate/teacher_turn_1","claim_ids":[],"language_receipt":{"known_forms":[],"frontier_forms":[],"instruction_phrases":[],"rescue_phrases":[],"unlicensed_forms":[]}}},
  {"event_type":"teacher_turn","actor":"luna","phase":"affirmative","exercise_id":"l001-cp-a03-spoon","payload":{"action":"ask","delivery_mode":"machine_control","text":"SHOW_LABEL_SELECT_MATCHING_IMAGE","script_ref":"l001-cp-a03-spoon/teacher_turn_1","claim_ids":[],"language_receipt":{"known_forms":[],"frontier_forms":[],"instruction_phrases":[],"rescue_phrases":[],"unlicensed_forms":[]}}},
  {"event_type":"teacher_turn","actor":"luna","phase":"affirmative","exercise_id":"l001-cp-a04-bowl","payload":{"action":"ask","delivery_mode":"machine_control","text":"SHOW_LABEL_SELECT_MATCHING_IMAGE","script_ref":"l001-cp-a04-bowl/teacher_turn_1","claim_ids":[],"language_receipt":{"known_forms":[],"frontier_forms":[],"instruction_phrases":[],"rescue_phrases":[],"unlicensed_forms":[]}}},
  {"event_type":"teacher_turn","actor":"luna","phase":"affirmative","exercise_id":"l001-cp-a05-fork","payload":{"action":"ask","delivery_mode":"machine_control","text":"SHOW_LABEL_SELECT_MATCHING_IMAGE","script_ref":"l001-cp-a05-fork/teacher_turn_1","claim_ids":[],"language_receipt":{"known_forms":[],"frontier_forms":[],"instruction_phrases":[],"rescue_phrases":[],"unlicensed_forms":[]}}},
  {"event_type":"teacher_turn","actor":"luna","phase":"affirmative","exercise_id":"l001-cp-a06-knife","payload":{"action":"ask","delivery_mode":"machine_control","text":"SHOW_LABEL_SELECT_MATCHING_IMAGE","script_ref":"l001-cp-a06-knife/teacher_turn_1","claim_ids":[],"language_receipt":{"known_forms":[],"frontier_forms":[],"instruction_phrases":[],"rescue_phrases":[],"unlicensed_forms":[]}}},
  {"event_type":"teacher_turn","actor":"luna","phase":"affirmative","exercise_id":"l001-cp-a07-glass","payload":{"action":"ask","delivery_mode":"machine_control","text":"SHOW_LABEL_SELECT_MATCHING_IMAGE","script_ref":"l001-cp-a07-glass/teacher_turn_1","claim_ids":[],"language_receipt":{"known_forms":[],"frontier_forms":[],"instruction_phrases":[],"rescue_phrases":[],"unlicensed_forms":[]}}},
  {"event_type":"teacher_turn","actor":"luna","phase":"affirmative","exercise_id":"l001-cp-a08-napkin","payload":{"action":"ask","delivery_mode":"machine_control","text":"SHOW_LABEL_SELECT_MATCHING_IMAGE","script_ref":"l001-cp-a08-napkin/teacher_turn_1","claim_ids":[],"language_receipt":{"known_forms":[],"frontier_forms":[],"instruction_phrases":[],"rescue_phrases":[],"unlicensed_forms":[]}}}
]
