[{"event_type":"teacher_turn","actor":"luna","phase":"transfer","exercise_id":"l001-a002-v3-transfer-cup","payload":{"action":"present","delivery_mode":"machine_control","text":"SHOW_IMAGE_RECORD_BARE_LABEL","script_ref":"l001-a002-v3-transfer-cup/teacher_turn_1","claim_ids":[],"language_receipt":{"known_forms":[],"frontier_forms":[],"instruction_phrases":[],"rescue_phrases":[],"unlicensed_forms":[]}}}]
