[{"event_type":"teacher_turn","actor":"luna","phase":"mixed_practice","exercise_id":"l001-m02-W_question-cup","payload":{"action":"ask","delivery_mode":"machine_control","text":"SHOW_IMAGE_RECORD_BARE_LABEL","script_ref":"l001-m02-W_question-cup/teacher_turn_1","claim_ids":[],"language_receipt":{"known_forms":[],"frontier_forms":[],"instruction_phrases":[],"rescue_phrases":[],"unlicensed_forms":[]}}}]
