[{"event_type":"teacher_turn","actor":"luna","phase":"OR_question","exercise_id":"l001-cp-o03-spoon","payload":{"action":"ask","delivery_mode":"machine_control","text":"SHOW_IMAGE_SELECT_ONE_OF_TWO_LABELS","script_ref":"l001-cp-o03-spoon/teacher_turn_1","claim_ids":[],"language_receipt":{"known_forms":[],"frontier_forms":[],"instruction_phrases":[],"rescue_phrases":[],"unlicensed_forms":[]}}}]
