[
  {
    "event_type": "student_turn",
    "actor": "sol",
    "phase": "affirmative",
    "exercise_id": "l001-cp-a02-plate",
    "payload": {
      "text": "option-image:l001-cp-a02-plate:plate",
      "behavior_tag": "correct_machine_selection",
      "simulator_basis": "hidden_profile_and_known_closure"
    }
  }
]
