[
  {"event_type":"student_turn","actor":"sol","phase":"closing_recap","exercise_id":"l001-r01-cup","payload":{"text":"cup","behavior_tag":"correct_bare_label","simulator_basis":"hidden_profile_and_known_closure"}},
  {"event_type":"student_turn","actor":"sol","phase":"closing_recap","exercise_id":"l001-r02-plate","payload":{"text":"plate","behavior_tag":"correct_bare_label","simulator_basis":"hidden_profile_and_known_closure"}},
  {"event_type":"student_turn","actor":"sol","phase":"closing_recap","exercise_id":"l001-r03-spoon","payload":{"text":"fork","behavior_tag":"incorrect_bare_label","simulator_basis":"hidden_profile_and_known_closure"}},
  {"event_type":"student_turn","actor":"sol","phase":"closing_recap","exercise_id":"l001-r04-bowl","payload":{"text":"bowl","behavior_tag":"correct_bare_label","simulator_basis":"hidden_profile_and_known_closure"}},
  {"event_type":"student_turn","actor":"sol","phase":"closing_recap","exercise_id":"l001-r05-fork","payload":{"text":"fork","behavior_tag":"correct_bare_label","simulator_basis":"hidden_profile_and_known_closure"}},
  {"event_type":"student_turn","actor":"sol","phase":"closing_recap","exercise_id":"l001-r06-knife","payload":{"text":"knife","behavior_tag":"correct_bare_label","simulator_basis":"hidden_profile_and_known_closure"}},
  {"event_type":"student_turn","actor":"sol","phase":"closing_recap","exercise_id":"l001-r07-glass","payload":{"text":"cup","behavior_tag":"incorrect_bare_label","simulator_basis":"hidden_profile_and_known_closure"}},
  {"event_type":"student_turn","actor":"sol","phase":"closing_recap","exercise_id":"l001-r08-napkin","payload":{"text":"napkin","behavior_tag":"correct_bare_label","simulator_basis":"hidden_profile_and_known_closure"}}
]
