[
  {"event_type":"teacher_turn","actor":"luna","phase":"W_question","exercise_id":"l001-cp-w02-plate","payload":{"action":"ask","delivery_mode":"machine_control","text":"SHOW_IMAGE_RECORD_BARE_LABEL","script_ref":"l001-cp-w02-plate/teacher_turn_1","claim_ids":[],"language_receipt":{"known_forms":[],"frontier_forms":[],"instruction_phrases":[],"rescue_phrases":[],"unlicensed_forms":[]}}}
]
