[{"event_type":"teacher_turn","actor":"luna","phase":"mixed_practice","exercise_id":"l001-m03-OR_question-knife","payload":{"action":"ask","delivery_mode":"machine_control","text":"SHOW_IMAGE_SELECT_ONE_OF_TWO_LABELS","script_ref":"l001-m03-OR_question-knife/teacher_turn_1","claim_ids":[],"language_receipt":{"known_forms":[],"frontier_forms":[],"instruction_phrases":[],"rescue_phrases":[],"unlicensed_forms":[]}}}]
