[
{"event_type":"teacher_turn","actor":"luna","phase":"presentation","exercise_id":"l001-p1-affirmative-model","payload":{"action":"present","delivery_mode":"machine_control","text":"WORKED_affirmative","script_ref":"l001-p1-affirmative-model","claim_ids":["L001-table-object-labels"],"language_receipt":{"known_forms":[],"frontier_forms":[],"instruction_phrases":[],"rescue_phrases":[],"unlicensed_forms":[]}}},
{"event_type":"teacher_turn","actor":"luna","phase":"presentation","exercise_id":"l001-p1-affirmative-model","payload":{"action":"present","delivery_mode":"machine_control","text":"WORKED_affirmative","script_ref":"l001-p1-affirmative-model","claim_ids":["L001-table-object-labels"],"language_receipt":{"known_forms":[],"frontier_forms":[],"instruction_phrases":[],"rescue_phrases":[],"unlicensed_forms":[]}}},
{"event_type":"teacher_turn","actor":"luna","phase":"presentation","exercise_id":"l001-p1-affirmative-model","payload":{"action":"present","delivery_mode":"machine_control","text":"WORKED_affirmative","script_ref":"l001-p1-affirmative-model","claim_ids":["L001-table-object-labels"],"language_receipt":{"known_forms":[],"frontier_forms":[],"instruction_phrases":[],"rescue_phrases":[],"unlicensed_forms":[]}}},
{"event_type":"teacher_turn","actor":"luna","phase":"presentation","exercise_id":"l001-p1-affirmative-model","payload":{"action":"present","delivery_mode":"machine_control","text":"WORKED_affirmative","script_ref":"l001-p1-affirmative-model","claim_ids":["L001-table-object-labels"],"language_receipt":{"known_forms":[],"frontier_forms":[],"instruction_phrases":[],"rescue_phrases":[],"unlicensed_forms":[]}}},
{"event_type":"teacher_turn","actor":"luna","phase":"presentation","exercise_id":"l001-p1-affirmative-model","payload":{"action":"present","delivery_mode":"machine_control","text":"WORKED_affirmative","script_ref":"l001-p1-affirmative-model","claim_ids":["L001-table-object-labels"],"language_receipt":{"known_forms":[],"frontier_forms":[],"instruction_phrases":[],"rescue_phrases":[],"unlicensed_forms":[]}}},
{"event_type":"teacher_turn","actor":"luna","phase":"presentation","exercise_id":"l001-p1-affirmative-model","payload":{"action":"present","delivery_mode":"machine_control","text":"WORKED_affirmative","script_ref":"l001-p1-affirmative-model","claim_ids":["L001-table-object-labels"],"language_receipt":{"known_forms":[],"frontier_forms":[],"instruction_phrases":[],"rescue_phrases":[],"unlicensed_forms":[]}}},
{"event_type":"teacher_turn","actor":"luna","phase":"presentation","exercise_id":"l001-p1-affirmative-model","payload":{"action":"present","delivery_mode":"machine_control","text":"WORKED_affirmative","script_ref":"l001-p1-affirmative-model","claim_ids":["L001-table-object-labels"],"language_receipt":{"known_forms":[],"frontier_forms":[],"instruction_phrases":[],"rescue_phrases":[],"unlicensed_forms":[]}}},
{"event_type":"teacher_turn","actor":"luna","phase":"presentation","exercise_id":"l001-p1-affirmative-model","payload":{"action":"present","delivery_mode":"machine_control","text":"WORKED_affirmative","script_ref":"l001-p1-affirmative-model","claim_ids":["L001-table-object-labels"],"language_receipt":{"known_forms":[],"frontier_forms":[],"instruction_phrases":[],"rescue_phrases":[],"unlicensed_forms":[]}}},
{"event_type":"teacher_turn","actor":"luna","phase":"presentation","exercise_id":"l001-p1-affirmative-model-check-understanding","payload":{"action":"ask","delivery_mode":"machine_control","text":"SHOW_LABEL_SELECT_MATCHING_IMAGE","script_ref":"l001-p1-affirmative-model-check-understanding","claim_ids":["L001-table-object-labels"],"language_receipt":{"known_forms":[],"frontier_forms":[],"instruction_phrases":[],"rescue_phrases":[],"unlicensed_forms":[]}}}
]
