[{"event_type":"teacher_turn","actor":"luna","phase":"comprehension","exercise_id":"l001-a002-v3-next-after-cup","payload":{"action":"present","delivery_mode":"machine_control","text":"SHOW_PAGE_SELECT_NEXT_SCENE","script_ref":"l001-a002-v3-next-after-cup/teacher_turn_1","claim_ids":[],"language_receipt":{"known_forms":[],"frontier_forms":[""],"instruction_phrases":[],"rescue_phrases":[],"unlicensed_forms":[]}}}]
